Asociația Culturală Metropolis;Str. Constantin F. Robescu, nr. 1 bis, sect. 3, Bucharest, ROMANIA;NGO;http://www.balkanikfestival.ro/;Cinema, Music;Festival;"Asociația Culturală Metropolis is an NGO association founded by Daniel Mitulescu in 2011 in Bucharest. The cultural profile coupled to Asociația Culturală Metropolis is quality audio-visual and film productions presenting high quality national and international (European) films, world music from the midd le east and Balkan. The association is involved in a large range of activities in the field of the festivals - cinema, media literacy, cultural heritage, music, craftsmanship, and visual art and film distribution. These activities are in accordance with the main aims of the Association in terms of Audience Development.<br/>Balkanik Festival is a socio-cultural project, aiming at creating a bridge of understanding between the country’s minorities and encouraging cultural diversity and intercultural dialogue. It is an international multicultural and multidisciplinary festival (artists from other countries, media partners with international coverage, partnerships with similar festivals from all Europe, collaboration with embassies and foreign cultural institutes) addressed to national and international audiences. The festival gives spaces to several ethnic groups from the Balkans, but also artist groups from countries like France, Belgium, Germany, Syria, Iran, India, Canada etc. The festival has a multidisciplinary program schedule that includes music, arts crafts fair, dance, painting, sculpture, photography, circus shows, culinary art etc.";"Asociația Culturală Metropolis has explored new strategies for AD and it can be seen as an audience-centric organization: indeed AD vision and projects are part of the general strategic plan. Asociația Culturală Metropolis’ AD approach emerged from the first artistic project and was conceived with the perspective of building long lasting relationships with diversified audiences. Asociația Culturală Metropolis’ approach to AD is not project based, but more process oriented and holistic. The organic model means that AD is integrated to the overall work organization and activities. Daniel Mitulesco, the director, Ligia Kesisian-Mitulescu, the artistic director, and the PR responsible, develops the Ad strategy.<br/>Balkanik Festival is addressed to a more general public and attracts all age groups providing activities for them. However, a large number of its spectators are young (2540), with high levels of education and moderate to high income, living in urban areas, coming from Romania or abroad (mostly Western Europe).<br/>AD goals aims at: <br/>- Deepening the relationship with the audience (audience by choice), using Internet and social media channels actively, organizing competitions for winning invitations to the festival, teaser events before the festival, workshops for different age groups within the fair, working with volunteers.<br/>- Enlarging the audience through activities addressed to specific target audiences:<br/>Focus on children: organizing playgrounds and workshops within the arts and crafts fair,<br/>Focus on elder people: inviting unknown artists from rural areas in Romania, which are preferred by them, promoting the arts and crafts fair,<br/>Focus on minority groups: the arts and crafts fair and the concerts are inspired by their culture, organizations representing minorities receive invitations to the festival.";"Asociația Culturală Metropolis aims also at having an impact on mentalities in Romanian society, promoting European values such as tolerance, non-discrimination, celebration of diversity and multiculturalism, respect and appreciation for minorities. <br/>Asociația Culturală Metropolis is raising sensitivity for film, in a close dialogue with audiences, due to an integrated programming and mediation, a supply-balancing put of a cultural policy and film culture. <br/>In terms of impact Balkanik festival aims at increasing the general public’s knowledge of the cultural traditions of the Balkans and of minorities in Romania, increasing the levels of tolerance and social inclusion (especially of the Roma community), ensuring and increasing the access to diverse and good quality contemporary art by inviting around 150 artists each year and displaying diverse forms of artistic expression.";building capacity, by choice, by habit, by surprise, organisational change, place
Auditorio de Tenerife “Adán Martín”;Av de la Constitución, 1, 38003 Santa Cruz de Tenerife, Tenerife Island, Canary Islands, SPAIN;Public Company;www.auditoriodetenerife.com;Music;Concerts, Performances;The Auditorio de Tenerife, designed by the renowned architect Santiago Calatrava, is considered one of the most emblematic buildings of Spanish architecture. It is located in the city of Santa Cruz de Tenerife in an impressive site, next to the Atlantic Ocean and in front of the ancient Anaga Mountains. It opened on September 2003 and was conceived to become the home of the Tenerife Symphony Orchestra, the Canary Islands Music Festival and the Opera Festival, organised by that time by the local association of opera friends. Therefore, the building was equipped with a philharmonic hall (1658 seats), a chamber hall (428 seats) and some smaller areas, such as rehearsal and meeting rooms or dance and exhibition halls.;"The Auditorium has travelled abroad on a regular basis to obtain training or to get to know other case studies and best practices. From the outset they understood that audience analysis was crucial to implement a successful AD approach. Hence, a great emphasis has always been placed on the information systems.<br/>In 2004, when most of the theatres in Spain were still selling their tickets at the box office, the Auditorium already had a ticketing system running. In certain performances they even reached peaks of 72% of the tickets sold online. This enabled them to get a global picture of what was happening in terms of sales: the type of tickets sold and of the channels in which they were sold. For instance, once they observed that a lot of tickets were sold in shopping malls and afterwards they decided to create specific marketing campaigns in those venues.<br/>Considering the three types of audiences - by habit, by choice and by surprise – the Auditorio de Tenerife pursues all of them, but the strategy varies depending on the product. Sometimes the accent is on diversifying audiences, while in other cases it is put on widening or deepening audiences.";"Three factors have underpinned the AD approach in the Auditorio de Tenerife. Firstly, the Auditorium, as a public space, was guided by a public notion on culture and concepts like accessibility or inclusion were part of its DNA. Secondly, a very important element was the fact that the Council of Tenerife was also aligned with this approach and that it was a real support and not a stopper for the different projects in which the Auditorium decided to embark on. Finally, a crucial aspect was the team, the people who had the vision and took it further, working together in a flexible way and implicitly accepting an organic bottom-up change. <br/>The AD approach of the Auditorium emerged from the first artistic project and was conceived with the perspective of building long lasting relationships with a diversified audience. Programming, production and education were essential building blocks of the project. The marketing director, who had a background working in private companies outside the cultural sector, understood that the principles of cultural and general marketing were mainly the same. This dissonance between the different perspectives on AD has enriched the organisation as it has led to a constant tension that has triggered projects that probably would not have been born. The type of projects developed to persuade the marketing department of the artistic approach were small-scale initiatives with the aim of building long lasting relationships with certain segments of the audience and with the local community.";building capacity, by choice, by habit, by surprise, data, leadership, place
Brighton Early Music Festival;Ham Cottage, Albourne Road, Hurstpierpoint, West Sussex, UNITED KINGDOM;Company limited by guarantee / Registered charity;www.bremf.org.uk;Music, Performing Arts;Concerts, Education, Festival;"Brighton Early Music Festival (BREMF) was co-founded by artistic directors Clare Norburn and Deborah Roberts as a pilot project in 2002 in Brighton, East Sussex. To date it’s the largest early music festival (with a Brighton twist) in the South of England. The main activity of the charity is the festival, which takes place in late October and early November.<br/>The organisation’s objectives are:<br/>To encourage, advance, develop and maintain public education in appreciation of and involvement in pre-classical and classical music and the performing arts, by promoting periodically a series of public concerts, dramatic performances, exhibitions and other cultural events.<br/>To promote and assist in the advancement of public and professional education by the provision of workshops, lectures and educational events for people of all ages.";"Their AD strategy aims at broadening audiences, increasing numbers and diversifying audience experience: <br/>New audiences are vital for the growth and development of our organisation. <br/>1. Diversifying audiences: • A range of appealing and distinctive events, which challenge stereotypes about what, a classical concert can be – for example using cabaret format with atmospheric lighting “We challenge the idea of the audience sitting quietly in a row. (audience by choice/(audience by habit), • collaborating with different art forms such as theatre and dance (For example, in 2015 BREMF produced an Opera appealing to an audience of Opera goers but not necessarily of early music audience. As well as experimental collaboration with different art forms for example – aerial dancers.) (audience by habit), • taking events to new and unexpected spaces eg. pubs and clubs - Taking early music performers into existing open mic nights in Brighton pubs (audience by surprise), • working with their 16-30 User Group (audience members and young volunteers) to target younger audiences (Brighton has a large student population) (audience by choice). Ideas suggested by this group include their very successful £5 Prom tickets,<br/>2. Widening the audiences reaching out to audiences who are already attending cultural events but don’t regularly attend Brighton Early Music Festival. The BREMF Ambassadors AD group are key to this objective – they tap into their own networks to spread the word about the festival through word of mouth marketing. Initiatives spread by the BREMF Ambassadors led in increased penetration among family audiences, a preview article on Gscene and LGBT magazine, and scheme members bringing groups to the event (audience by habit).";"Their AD strategy is key to their development as an organization. The audience-centric approach is embedded in their mission and values. The Festival Producer Cathy Boyes, (a new role created in 2012) leads on AD work and this is a growing part of her responsibilities, overseen by Co-artistic Director Clare Norburn who has a strong background in AD and traditional marketing. Whereas the other director is very involved in building the music community in Brighton and she knows the barriers of accessing music. <br/>”Communicate your vision, we have a lot of volunteers and we talk to them a lot! Communicate with all our stakeholders.” <br/>“It informs our programme as well as our marketing.”<br/>What is interesting is that everybody in BREMF is focused on the audience goals outlined above. From the artistic directors to the volunteers they are keen to reach out to new audiences. The view of the artistic directors trickles down to the whole the organization. “Keep an open mind – open to new ideas and listen to everyone who is involved. Even though your immediate reaction is all this will not work!";by choice, by habit, by surprise, community rooted, data, organisational change, partnership, place
Bunker;Slomškova 7, SI - 1000 Ljubljana, SLOVENIA;Private institute, non-profit organization;www.bunker.si;Dance, Music, Performing Arts;Education, Festival, Networking, Performances, Research;Bunker is oriented to performing arts. It was established in 1997 as a private, non-profit institute in order to promote young performing artists through the Mladi Levi festival that was initiated in 1998. Since many other festivals have started to present emerging performing artists Bunker has expanded its commitment to performing arts through following areas: performing arts production, festivals, international cooperation through networks and collaboration projects, educational programs, discussion evenings and management of the venue located in the outskirts of Slovenia's capital city of Ljubljana. The venue is in an old power station converted into the performing arts centre. It is used by Bunker, but is also service/space for other performing arts organizations.;Owing to the legacy the organization has developed over the past 20 years, Bunker has its own regular audience, mainly “audience by habit” and related to Ljubljana's arts scene. But Bunker also targets different audiences, depending on the content of the program. The organisation initiated various programs (volunteer program, community projects, educational program) through which its audience base became more diverse, thus transitioning towards more audience-oriented organization. Enlarging and diversifying the audience are important for Bunker, but the main criteria for the organization is not following the logic of audience numbers but the quality of the arts and fostering meaningful relationships between artistic content and audience. In that sense, Bunker tries to create spaces for community where changes could develop. In order to provide more concrete impacts, Bunker provides space for laboratories in which explores new possible locations for AD. Deepening the relationship with the audience is done by personal contacts and discursive program while diversification is done through implementation of educational programs for young people or various participatory projects in local community. In that way Bunker has reached “audience by surprise”, people who come to see performances even they do not know what to expect and who usually do not attend Bunker's type of events. Using various methods, such as subtitles, kindergarten, free admissions, etc., Bunker also gathers “audience by choice”, people who are interested in specific themes, artists and events.;"Reflecting the need to find useful methods in approaching complexity that defines today's conditions in arts and culture, Bunker explores new strategies for AD and shifts towards the audience-centric organization. It is recognized as an organization that tries to involve artists and audiences in complex reflexive and critical dialogue. Working directly with different people and opening up various topics are extremely important for Bunker because in Slovenia, as Koprivšek stressed, “the media space for contemporary culture does not exist any more”. <br/>Bunker's approach to AD is not project based, but more process oriented and holistic. This organic model means that AD is integrated to the overall work of organization. As Bunker's organizational structure is horizontal, employees share responsibilities and each of them is in charge of content and budget of a certain project, Bunker's structure does not develop top-down approach to AD. Over the time, Bunker has changed the mode of work and starts to operate more trans-disciplinary (collaborates with urban planners, sociologists, educators, etc.), and participates in many different networks at the local, national or international level. When Bunker works in specific area, then it cooperates with experts, academics and researchers of particular field. To get more information on its audience, the organization conducts researches in the neighbourhood. Based on these data Bunker started few new projects. Bunker invested a lot of effort in organizing series of events to connect with local community and the most important result is the establishment of informal network of arts quarter Tabor that represents Bunker's neighbourhood and subsequently the space in which Bunker inscribes its work in order to improve the quality of life in this local district.";by choice, by habit, by surprise, community rooted, organisational change, partnership, place
CAOS - Centro Arti Opificio Siri;Viale Luigi Campofregoso, 98, 05100, Terni, ITALY;Temporary Consortium;www.caos.museum;Dance, Music, Performing Arts, Visual Arts;Concerts, Education, Exhibitions, Performances, Residency, Workshops;"In 2006 the first activity of Indisciplinarte was an international contemporary arts festival focused on performing arts in the town of Terni, a former industrial area in the centre of Italy, now completely dismissed and strongly marked by its industrial past. The festival has grown over years, and the initiative legitimised Indisciplinarte as a strong cultural player. <br/>First constituted as cultural association, Indisciplinarte became a private company and formed a consortium with other companies in a so-called “temporary association of enterprises”, to participate in a bid to manage the venue CAOS, a former industrial compound owned by the municipality. It was renovated and opened in 2009, in the centre of Terni. This marked a first step towards a different way of relating with the urban environment, since having a huge physical space pushed the company to find different ways of engaging with the local community. <br/>With over 5000m2 at its disposal, CAOS is a complex centre of art production, hosting two museums, one exhibition area, one theatre, a residency centre, a library, a café-restaurant, a cinema and a special area for educational activities with about 1100 activities annual. CAOS has established strong relationships with different partners operating locally, nationally and internationally: universities, associations, schools, cultural institutions (museums, libraries, etc.), theatre companies and venues, networks.";"After 7 years, they are now able to reach about 70.000 people, while the city of Terni has a population of 120.000. When they started, they were ‘just’ a performing arts festival, running one main activity, intense and successful, but also concentrated in time and space. They didn’t have a single venue and they were unable not even to know how many people participated in the festival. They just had the feeling they had started something important. After two years, the event with a strong artistic vision linked to active participation, brought them onto the agenda of the municipality. This led to the city tender for a private management of the CAOS venue. CAOS at first was thought as just the new venue for two city museums (art and archaeology), but now it is a vital cultural centre offering much more than museum visits. <br/>Participation increased over time, despite continuously decreasing public funding, thanks to the huge diversification of the cultural offer. Cinema, a theatre season, exhibitions, educational activities linked to the museums, were progressively added to the festival, leading to the full schedule that CAOS has today, where citizens can find something appealing each day. <br/>This happened mostly through a trial and error approach, through an extensive building of relations with other cultural institutions and stakeholders, locally and regionally. This openness led them to partnering with an increasing number of players, enriching the cultural offer and the market penetration of CAOS.";"Having an impact on people has always been a focus for Indisciplinarte, questioning and revising themselves in their work. Self-reflective practices as well as project evaluation are somehow part of their DNA. In the first year, their artistic vision and audience mission dominated this reflective practice. The need to become more structured appeared later: they have been observing, interviewing, talking with people as a common and daily practice, but they didn’t use these materials to collect and analyse quantitative data, partly because it was outside their competences, partly because it was also outside their idea of what was needed. <br/>One simple practice they adopted was to give up the external service that was managing the info desk, and to decide that every and each member of the staff should periodically work at the desk, in order to gain a shared and clearer idea of community needs and requests.<br/>If their focused listening attitude (“we don’t know their profile, we know their names!”) has been effective, things are changing because they feel it’s not enough to tackle the challenge of sustainability. After the first phase of providing a festival and a second phase of venue management, they feel ready for the next challenge: to structure their audience knowledge in data, and to find a way “to go from audience engagement to AD”.";building capacity, by choice, by habit, by surprise, co-creation, partnership, place
