Click Festival;Kulturværftet, The Culture Yard, Allegade 2, 3000 Elsinore, DENMARK;Initiative initiated and run by The Culture Yard, a Public Culture Centre owned by the Municipality of Elsinore;www.clickfestival.dk;Cinema, Dance, Digital Arts, Music, Performing Arts, Visual Arts;Festival, Performances, Workshops;"The CLICK Festival is an important, quite specific annual activity, which takes place over a weekend every year. It is initiated by the Culture Yard in Elsinore and realized through a complex collaboration with local and international partners, reaching out to an audience of 3.600 in 2016. CLICK reaches a segment with an interest in exploring the cross field between contemporary art, science and technology, those willing to get on board on a journey towards ‘undiscovered’ opportunities. <br/>The Culture Yard is a cross disciplinary and aesthetic institution aiming at a triangular vision based on three equally balanced elements: the artistic production, the social audience experience and the historical or architectural framework. Whether it is a performance, a concert, talks or art installations, these three elements form the very spine of the programming.";"The idea behind the festival is to embrace and explore new ‘territories’. The festival consists of performances, concerts, talks, exhibitions, workshops and what is described as the ‘Re-conquest of the Internet’. The program offers a variety of events, where the audience is invited to actively take part, to stay, to play and not least to connect to both digital and analogue activities. <br/>The vision behind CLICK is about the enforcement of cultural innovation. The vision is closely connected to Elsinore’s interregional strategy4 where people from culture, science, business and education strive to create new cultural improvements in the city. CLICK shall put Elsinore on the map as more than the site of Hamlet and give Denmark a new important platform of media art, wherefrom artists can improve, be exposed and create contacts in an international context.<br/>CLICK is an example of how the Culture Yard works with deepening the relationship with a defined target group. Through connecting to networks and subcultures engaged with biotech, bio art, gentech, collaborative media, artists, researchers and the like, CLICK has become a meeting space for an innovative, curious and engaged segment, who seem to expect to be invited to participate and engage during their visit at the festival. By creating an interface with their audience, allowing them to contribute themselves, they have managed to increase numbers over the years and they now see the more return visits to the festival.";"CLICK is the result of collaboration with research and educational institutions as well as with a variety of other cultural institutions throughout Denmark and being part of networks and partnerships in particular USA and Asia, focusing on both curatorial and collaborative productions. The festivals content is largely curated through a co-operation of Danish and foreign competences of artists, scientists, students and professionals working with larger and smaller unions, educational institutions and companies. These form a group, which members are elected by the administrators of the festival program, and holds a close dialogue to their respective networks in order to keep an open and investigative dialogue with an extended group of interested. <br/>CLICK has a clear audience-specific focus - an audience by choice. Its purpose is to build an open platform that attracts a curios audience and give them the opportunity to become familiar with the current and innovative trends in art. Additionally, the ambition is to establish an environment where local, national and international artists as well as professionals and relevant companies can cooperate, share knowledge, expand networks and stimulate ideas. CLICK invites the audience to create solutions and possible answers to some of our times most challenging bio-technological and societal challenges, giving back the opportunity for change to the visitors. <br/>In terms of AD, the main objectives the Culture Yard has achieved through CLICK is the establishment of a slowly growing community of curious visitors and enthusiasts from all over Denmark, who comes to Elsinore to engage and participate in the activities and share knowledge, networks and ideas. However, it is a challenge for the future to be able to attract audiences different from the current and audiences with no or limited previous contact with the festival. <br/>The main obstacles or challenges for CLICK lies in the ability make the translation into more accessible formats and thus reaching out for a broader audience.";by choice, by habit, co-creation, community rooted, digital, place
Corners of Europe;Taking place in different corners of Europe, towns/urban local areas;Co-founded as a platform for co-created artistic projects and locally adapted events;www.cornersofeurope.org;Cinema, Dance, Digital Arts, Music, Performing Arts, Visual Arts;Education, Performances, Touring;"The over-arching aim with CORNERS is mobilizing new audiences for culture, to narrow the distance between art and the public, open up for shared cultural experiences, as well as connect artists, local cultures and citizens in different corners of Europe. Targeted audiences are at the centre of projects and events. Every project and event is constructed to keep AD as a core value. <br/>Projects and events, designed and co-created in mixed artist-groups, meant for public spaces and/or in close relation with specific local audiences, with a targeted focus. Projects with a neighbourhood focus and building a sense of community. Participatory elements for mobilizing different audiences for different levels of audience-involvement, active collaboration and co-creation. A parallel ambition is to interconnect artists from different geographical, social, political and professional backgrounds.<br/>A platform for multidisciplinary and collaborative artistic projects, under the slogan ‘turning Europe inside out’, designed and driven by cultural organizations at the edges of Europe, as partners in shared responsibility. The projects and events are linked to local conditions and audiences, spreading and linking experiences and stories, creating a shared feeling of belonging, regardless of in what corner of Europe one is living.";Toured projects embedded in local cooperation and co-creations. Relating to audiences in a new and more involved and participatory meaning. To a large degree, Audience by surprise. But also, a kind of “deepening” due to the participatory factor. During 20142017, CORNERS visited Umeå (Sweden) Haninge/Stockholm (Sweden), Prizren (Kosovo), Belfast (Northern Ireland), Vranje (Serbia), Northumberland (England), Rijeka (Croatia), Zagreb (Croatia), Ljubljana (Slovenia), Donostia/San Sebastian (Basque Country), Gdansk (Poland), East Durham (England) and Taranto (Italy).;"‘Audience Links’ and ‘CORNERS Live’ established as specific spaces and vehicles for connecting and learning. The digital extension functions as a hybrid exhibition, a broadcasting and collaborative online space which allows artists and audiences anywhere in the world to connect and share experience related to the diverse projects and events taking place in a local context. Associated workshops, seminars and conferences, internal and external, underpinning learning processes closely connected to AD as something developmental in them. <br/>The organizational structure is modelled for a democratic delegation of tasks and responsibilities among the team, the artists and with local actors, including as much as possible mediation experts, local artists and volunteers as extra resources involved in each project.<br/>They mobilize local resources and networks for each event, depending heavily on the local organizers and their dedication. They develop the capacities of the artists to engage directly with audiences/participants in co-creation. They establish formats for active participation. They develop digital strategies for extending the audience from a local level to transnational engagement.";by choice, by surprise, co-creation, community rooted, digital, partnership, place
Kilowatt Festival;Kilowatt Festival, Teatro alla Misericordia, via della Misericordia, 52037 Sansepolcro (Ar), ITALY;Cultural Association;www.kilowattfestival.it;Cinema, Dance, Music, Performing Arts, Visual Arts;Concerts, Education, Festival, Performances, Research, Residency;"Kilowatt is a festival dedicated to the new artists and companies of the contemporary scene (theatre, dance, music, literature, performing and visual arts, cinema) and takes place every summer in Sansepolcro (a small city in Tuscany, Italy). <br/>The festival was conceived in 2003 and it is promoted and implemented by the theatre company CapoTrave. Since its foundation, CapoTrave has been recognized by the Tuscany Region among the most interesting young companies in the regional landscape, and therefore eligible for funding. The Visionari Project was created in 2007. From 2008 Kilowatt Festival has supported theatre, dance and performing arts productions. Since 2009 the festival has opened a contemporary music section, and the year after a visual arts section. In 2010, the Tuscany Region placed CapoTrave among the top 30 theatre companies supported by regional funding, in 2013 it was recognized as an Artists’ Residency by the Region and in 2015 also by Italian Ministry of Culture.";"The festival aims to share with the audience a decision-making role, providing spectators with responsibilities in a common space of creation, exploring new models and concepts of participation, accessibility, interaction, social cohesion and empowerment. <br/>Kilowatt’s AD strategy concerns the way a Performing Art Organization conceives and operates to engaging actively people. The ultimate goal of the organization is to improve understanding, fulfilment and growth of all the actors involved in the artistic experience. <br/>Overall, Kilowatt’s audience goals are:<br/>• Development of new audiences for the festival, with particular attention to whom are not familiar with contemporary creation (audience by choice and by surprise) • Building a local community engaged with the festival (audience by habit and by choice)<br/>• Enlarging the participation of young people (in particular under 25 – audience by surprise)<br/>• Increasing loyalty to the festival (frequency of attendance – audience by habit and by choice)<br/>• Achieving a deeper engagement and building up an aware and mature audience (audience by habit)<br/>• Finding new way of engaging actively with people in the creative process (the selection of the shows and/or the creation of a new performance)<br/>• Improving understanding, fulfilment and growth of all those involved in the artistic experience";"Kilowatt’s AD strategy is key to its development as an organisation. The audience-centric approach is embedded in the nature of the festival as it has been formed during the years, and now it is what makes Kilowatt unique. The audience-centric approach is an organizational praxis, all the staff is involved and aware of its importance. <br/>Thanks to the participation in the European Project and to the public funding related to the Residency activities, Kilowatt has developed a long-term AD strategy, with the ambition of sharing results with the entire performing arts sector. Sharing is done thanks to the research project BeSpectACTive and finalized to understand the effect of the participative approach on the organisations, the audiences, and the artists. <br/>With the exception of the European Project, Kilowatt has not implemented specific evaluation tools. They made an only one survey on the public of the festival in 2011, and now they have the direct qualitative feedback of the Visionari. They made systematic analysis of the insights for Facebook and analytics for the website. <br/>The steady development of activities forced an increase of the staff, involved in all the phases of the programming, but also to a more hierarchical approach: the head of the management is now supported by the two creators of the festival and all the member of the staff are working strictly close to them, sharing responsibility and goals.";by choice, by habit, by surprise, co-creation, community rooted, economic sustainability, leadership, organisational change
Maison des Métallos;94 rue Jean-Pierre Timbaud, Paris 11e, FRANCE;Public Establishment of Cultural Cooperation;www.maisondesmetallos.org;Cinema, Dance, Digital Arts, Music, Performing Arts, Visual Arts;Concerts, Performances, Residency;"The XIX century building that now hosts MdM was a former music instruments factory, and then became headquarters of the Union Fraternelle des Métallos, a situation that lasted for 60 years and that left an important legacy in terms of place identity. Since the Union left in 1997, the building was run by a committee of inhabitants of the neighbourhood, who occupied it because they felt it was part of local identity. They were concerned about the forthcoming gentrification, which was starting at that time in the former working class neighbourhood. This sense of belonging of the local community had an important role in pushing the municipality of Paris to buy the venue, but also created at first some tension with the occupants as the city decided to convert it in a cultural venue run by an appointed director, that opened in 2007. So the first audience “issue” that MdM had to face, was to find the way to involve and resolve this tension. The relationship with the associations and former occupants took time to be reconstructed, but it’s today an important part of the identity of MdM and of its relation with the neighbourhood.<br/>MdM employs today 33 people, while artistic workers are “intermittent”. MdM programs many activities: theatre shows, exhibitions, talks, debates, projections, workshops, residencies for hosted or co-productions, participatory workshops and activities with schools. It also runs a bar, an activity that doesn’t bring money itself, but it’s conceived as public service, so an essential part of being always open and welcoming for the community. Thus one the main issue for them is to communicate the overall identity and openness of the place, not just the copious amount of single activities, and an effort to connect people to the venue somehow independently from the programming.";"MdM has a wide range of artistic and cultural programming, and starting from their mission they address all kind of audiences, with a specific focus on accessibility as democracy issue, thus they work intensively on audience by surprise to diversify as much as possible, building strong relationships with groups and associations active in the social exclusion field. MdM aims to bring all kind of people to “feel at home”, and runs outreach activities also outside the building in the neighbourhood to reach groups and individuals in order to foster this sense of belonging and participation and bring them in. <br/>In the last three years the work with schools and groups has grown constantly, fostering both an increase of numbers of diverse audiences and a strengthening of the relationship with them, so that today a sensible part of audience by surprise has somehow become audience by habit, thanks to a policy devoted both to reach and retain them. This success is foreseen through an intense work of partnership building, which is essential to reach audience by surprise (schools, institutions, associations, etc.), a long and on-going process that requires lot of time, as well as a strong attention to making the whole environment able to welcome everybody. <br/>Since they have a more consolidated and on-going work with groups and schools, the work with individuals - those audiences by choice from Paris area who use to attend theatre shows but usually don’t come to this neighbourhood - is a major challenge. It’s a field they are experimenting on, which is difficult because of the major competition in cultural offer of Paris, and here is where outreach staff work more closely to the communication department. An audience objective related to this is to increase paying visitors: only theatre shows are charged, and most of activities for schools and groups are for free, whilst there are special and different price policies for partners card holders. Although incomes from ticketing and space rentals have grown in the last three years, increasing revenues is one MdM challenges.";"Although the clear mission of MdM, since its establishment, was to involve and engage all kind of audience, with a strong and specific attention to those who are usually far from cultural practice, the organisation had to change over time in order to be more effective in pursuing its mission. Three main leadership and organisational changes happened between 2009 and 2013. <br/>The first big change was in leadership as, after two years opening, two new artistic directors - Philippe Mourrat and Christine Chalas - were appointed by the municipality, also in relation to their artistic project focused on programming contemporary works with a strong attention to audiences.<br/>The new directors changed also the way outreach staff organised the reach and engage of audiences. Since then, three persons were devoted to promote the cultural offer among all kind of audiences, but because it was not about selling tickets rather about building relationships, this distinction didn’t work. Today the same persons are in charge to work each with different and specific segments: one with schools, one with groups, and one with individuals. This allowed the outreach staff to create and feed lasting relationships with different social groups, and led to an increasing of audience and loyalty in all segments.<br/>A part from those changes, what’s specific of MdM (there are just a couple of theatres in France with the same role) is also that they have a work figure specifically devoted to link the artistic programming with AD objectives. The chief of Production (Responsable de Production et Médiation) is also in charge of Mediation and works very close with the Chief of Audiences (Pôle Publics). Although artistic directors choose in total autonomy artists and productions, these are always productions with a strong link to audiences, so the Chief of Production and Mediation works with artists not only to define all production related issues and practicalities, but also to plan and build with them the mediation related activities: meetings, workshops, and whatever can be done with and by the artists to mediate with different kind of audiences are therefore part of negotiation and contracting. This “mediation” side of their artistic job also forms part of the financial negotiation and logistic, and that’s also why they are in charge to the production department.";by choice, by habit, by surprise, community rooted, data, leadership, organisational change, partnership, place
Opgang2;Frederiks Allé 20 B, 8000 Århus C, DENMARK;Independent cultural institution;www.opgang2.dk;Music, Performing Arts;Concerts, Education, Performances, Workshops;"Opgang2 is an independent cultural institution based in Aarhus. The organisation focuses the three core areas: Opgang2 Theatre, Opgang2 Film and Opgang2 Youth Track (Ungdomsspor). Since the beginning in 1974 Opgang2 has grown into becoming one of the most significant professional institutions for youth programs and activities within theatre and film. The three departments work both independently and together, united under the common OPGANG2 logo. <br/>Opgang2 is housed in a former school in the centre of Aarhus. The venue frames all three activities and offers a theatre stage, studios and workshop facilities as well as education rooms for learning programs. The Opgang2 Theatre brings professional theatre to the all parts of Denmark, especially to an unfamiliar theatre audience. The touring theatre performs between 100 and 150 performances each year and all new shows have their premiere at the Aarhus Theatre, the regional main venue for theatre and performing arts. In 2014 the theatre won a Reumert (Best Child and Youth Performance) for the show 4 EVER.";"As an independent cultural institution Opgang2 produce professional theatre productions, documentaries and cultural festivals with and for a young audience – and they engage the youth in a partnership with the artists. The spine of Opgang2 is the use of art and culture as a transforming power to move and create movement. To challenge stereotypes and provoke taboos and in doing so building bridges between people across ethnic, social, cultural and psychological barriers with the overall aim to change people's views of themselves and others. As such the organisation has a clear inclusive and democratic agenda.<br/>On the website Opgang2 defines the ambition to help to create a Denmark that values the individual's unique quality in meaningful communities. This is done through a deliberate artistic and pedagogical method developed over more than 40 years’ practice as a socially engaged initiative. The organization addresses and promotes a deep faith in the ability of the individuals they serve. <br/>The stories presented are taken from the communities in and around Aarhus, picturing the surrounding reality, as seen and felt by the “unruly and disaffected - bruised and confused - edged and chaotic - seeking and courageous young”. The performances circle and provide sharp narratives on essential and uncomfortable social issues as a way to create a strong resonance in the young audience.";"As co-creation and a high degree of participation has been the very core of Opgang2s productions the social engagement in the community from the side of the organization is much about finding ways to ease the participation of the young people that deliver so much and who live in the periphery of the Danish welfare state. The Opgang2 model takes a fundamentally different starting point than Danish society as such, in addressing the young as a resource for the artistic and educational projects and in doing so creating an environment and experiences that reinforce the ability, the will and belief in their own power and their own potential. In a Danish perspective this is a unique position18. <br/>In 2015, 25.000 young saw the theatre’s performances of which roughly 23.000 were from outside Aarhus. As one of very few theatres in Denmark, Opgang2 reaches suburban migrant communities from all parts of the country. This has given them an exclusive position and they are widely regarded as one of the most significant intercultural players in the country. <br/>Throughout the years Opgang2 has positioned itself as a still more important institution high lightening the life circumstances of marginalised young people by giving them an opportunity through art to express and frame their own stories to a young audience. Opgang2 is motivated and established in order to foster change and inclusion of those who are left outside the norm and cultural offerings through a deliberate artistic and pedagogical method, where the young people become co-creators of the productions, all anchored in narratives deriving from the young themselves.";building capacity, by choice, by surprise, co-creation, community rooted, place
